{
  "backend_kind": "openai-compatible",
  "capabilities": {
    "edit": false,
    "execution_owner": "runtime",
    "generate": true,
    "mask": false,
    "max_reference_images": 0
  },
  "credential_ref": "keychain:leo-ppt-generator/zhipu",
  "credential_source": "os-store-reference",
  "endpoint_origin": "https://open.bigmodel.cn",
  "mode": "generate",
  "model": "cogview-4",
  "provider": "zhipu",
  "schema_version": 1,
  "selection": {
    "config_digest": null,
    "priority": null,
    "source": "user-confirmed"
  },
  "selection_source": "user-confirmed"
}
